{
  "archived_mismatch_checkpoints": [
    {
      "case_id": "ac01659b881b0aba",
      "panel_id": "narrow_profile",
      "path": "evidence/numerical/bosch_ray_phase_a_checkpoints/ac01659b881b0aba_cycle016.npz",
      "rays_per_point": 250,
      "sha256": "bfa903b24a15164cf4a07ce510ab83ebb95e76935bcf5d0239340e1e3590daa5"
    },
    {
      "case_id": "4dec8ca8d6c2425a",
      "panel_id": "narrow_profile",
      "path": "evidence/numerical/bosch_ray_phase_a_checkpoints/4dec8ca8d6c2425a_cycle016.npz",
      "rays_per_point": 500,
      "sha256": "869e53f20914c5af1fdfec8cf202d3865f37d700c39b50c69cfdf4aa0cc0ba83"
    },
    {
      "case_id": "6de51ac37c4bb2c9",
      "panel_id": "narrow_profile",
      "path": "evidence/numerical/bosch_ray_phase_a_checkpoints/6de51ac37c4bb2c9_cycle016.npz",
      "rays_per_point": 500,
      "sha256": "806e108f126f66d9c2a0fc01354909e0e4f5cd3df78b0a1c987dee3c02ab434f"
    },
    {
      "case_id": "653dc541ad425d86",
      "panel_id": "narrow_profile",
      "path": "evidence/numerical/bosch_ray_phase_a_checkpoints/653dc541ad425d86_cycle016.npz",
      "rays_per_point": 250,
      "sha256": "140e1f9624e019d264be144cd044fce5b01c7d6a7eb31c2b9dd33a62fbf9f23c"
    },
    {
      "case_id": "ea7984ad7fe397d8",
      "panel_id": "narrow_profile",
      "path": "evidence/numerical/bosch_ray_phase_a_checkpoints/ea7984ad7fe397d8_cycle016.npz",
      "rays_per_point": 250,
      "sha256": "77ad742b040c9ddcf9390b0ba0b9fd443aaf3a1aec5e1c125f81b24a292513af"
    },
    {
      "case_id": "0d0e89639259f97f",
      "panel_id": "narrow_profile",
      "path": "evidence/numerical/bosch_ray_phase_a_checkpoints/0d0e89639259f97f_cycle016.npz",
      "rays_per_point": 500,
      "sha256": "334d3c1a63f4fec07f0ccac2c66d2948a950f419a86f2bb870189a611f1f90df"
    },
    {
      "case_id": "b63d4698758439b7",
      "panel_id": "availability_challenge",
      "path": "evidence/numerical/bosch_ray_phase_a_checkpoints/b63d4698758439b7_cycle004.npz",
      "rays_per_point": 250,
      "sha256": "3911d47e99cfb4a4dc85f8115f8d0654e5612919ff666ae746d51f2a6c121373"
    },
    {
      "case_id": "4f82fa179d9a531e",
      "panel_id": "availability_challenge",
      "path": "evidence/numerical/bosch_ray_phase_a_checkpoints/4f82fa179d9a531e_cycle004.npz",
      "rays_per_point": 500,
      "sha256": "250fa383f0266fb457fefbbbdbb42cb1aa6a0fe80a1f99b4436bd6e532f8d9b1"
    }
  ],
  "campaign": "bosch-ray-phase-a-v1",
  "categorical_mismatches": [
    {
      "assumed_band_check_matches": {
        "bow": true,
        "depth": false,
        "width": true
      },
      "availability_match": true,
      "pair_id": "availability_challenge:stream_1",
      "panel_id": "availability_challenge",
      "selected_cycle_match": true
    },
    {
      "assumed_band_check_matches": {
        "bow": false,
        "depth": true,
        "width": true
      },
      "availability_match": true,
      "pair_id": "narrow_profile:stream_1",
      "panel_id": "narrow_profile",
      "selected_cycle_match": true
    },
    {
      "assumed_band_check_matches": {
        "bow": false,
        "depth": true,
        "width": true
      },
      "availability_match": true,
      "pair_id": "narrow_profile:stream_2",
      "panel_id": "narrow_profile",
      "selected_cycle_match": true
    },
    {
      "assumed_band_check_matches": {
        "bow": false,
        "depth": true,
        "width": true
      },
      "availability_match": true,
      "pair_id": "narrow_profile:stream_3",
      "panel_id": "narrow_profile",
      "selected_cycle_match": true
    }
  ],
  "comparisons": [
    {
      "assumed_band_check_matches": {
        "bow": true,
        "depth": false,
        "width": true
      },
      "availability_match": true,
      "failure": null,
      "metric_deltas": {
        "cd_bottom": 0.004731627372539071,
        "cd_max": 0.0007843348486904489,
        "cd_middle": 0.005797209303970208,
        "cd_min": 0.005581650763565538,
        "cd_top": 0.001188315318609079,
        "depth": 0.0076580501376855015,
        "max_bow": 0.00161122816755499,
        "max_cd_error": 0.0007843348486904489,
        "maximum_center_shift": 0.00027341992163365525,
        "scallop_rms": 0.00039113292495667265,
        "sidewall_angle_deg": 0.14080303730007238
      },
      "pair_id": "availability_challenge:stream_1",
      "panel_id": "availability_challenge",
      "repeat_index": 0,
      "runtime_s": {
        "250": 76.08399670801009,
        "500": 142.70701612500125
      },
      "selected_cycle_match": true,
      "sources": {
        "250": {
          "event_hash": "d65228a1990263e12b58ff4990c0b4b6fa6dbe62ae84f75573de470ba9b66702",
          "line_number": 31
        },
        "500": {
          "event_hash": "035e07ad94b4e918b1506408af6704b5d180343f11db2bf8826b4fad19516803",
          "line_number": 32
        }
      },
      "state_match": true,
      "states": {
        "250": "complete_measured",
        "500": "complete_measured"
      }
    },
    {
      "assumed_band_check_matches": {
        "bow": true,
        "depth": true,
        "width": true
      },
      "availability_match": true,
      "failure": null,
      "metric_deltas": {
        "cd_bottom": 0.0032986698154912064,
        "cd_max": 0.004099954930754324,
        "cd_middle": 0.0006780767143260702,
        "cd_min": 0.001180974836501314,
        "cd_top": 0.0008800675875145769,
        "depth": 0.0001349106771453279,
        "max_bow": 0.0002560359740898521,
        "max_cd_error": 0.004099954930754324,
        "maximum_center_shift": 0.000616098943241522,
        "scallop_rms": 2.2104919704432624e-05,
        "sidewall_angle_deg": 0.1268907623654808
      },
      "pair_id": "current_grid_reference:stream_1",
      "panel_id": "current_grid_reference",
      "repeat_index": 0,
      "runtime_s": {
        "250": 31.749875584006077,
        "500": 58.09411083301529
      },
      "selected_cycle_match": true,
      "sources": {
        "250": {
          "event_hash": "741cb58803f383e99ac7442a355914555b7051c18dd95084354b0a341bdf1d59",
          "line_number": 1
        },
        "500": {
          "event_hash": "637c15f353ff65f65319a3161df2c3b2c56e926f906382e3b74802d73e51063a",
          "line_number": 2
        }
      },
      "state_match": true,
      "states": {
        "250": "complete_measured",
        "500": "complete_measured"
      }
    },
    {
      "assumed_band_check_matches": {
        "bow": true,
        "depth": true,
        "width": true
      },
      "availability_match": true,
      "failure": null,
      "metric_deltas": {
        "cd_bottom": 0.0007701403813377139,
        "cd_max": 5.721002129754904e-05,
        "cd_middle": 0.0010317842915920084,
        "cd_min": 0.0007802663025794354,
        "cd_top": 0.00045738198700723265,
        "depth": 0.0032393310537151,
        "max_bow": 0.00015518698989946955,
        "max_cd_error": 5.721002129754904e-05,
        "maximum_center_shift": 0.0006228724546432224,
        "scallop_rms": 5.1777473646865465e-05,
        "sidewall_angle_deg": 0.013310723341039984
      },
      "pair_id": "design_center:stream_1",
      "panel_id": "design_center",
      "repeat_index": 0,
      "runtime_s": {
        "250": 16.457620708999457,
        "500": 30.42578141699778
      },
      "selected_cycle_match": true,
      "sources": {
        "250": {
          "event_hash": "756b57c936ed49bcbac0b93a26eb93272c291a44faf0ceff2b0d52f1d06553a6",
          "line_number": 4
        },
        "500": {
          "event_hash": "6f362ab029068be632236ded6964849861cb764b1b371576c248d09ec48a1b0f",
          "line_number": 3
        }
      },
      "state_match": true,
      "states": {
        "250": "complete_measured",
        "500": "complete_measured"
      }
    },
    {
      "assumed_band_check_matches": {
        "bow": true,
        "depth": true,
        "width": true
      },
      "availability_match": true,
      "failure": null,
      "metric_deltas": {
        "cd_bottom": 0.0010444030717862707,
        "cd_max": 0.0003054480468538956,
        "cd_middle": 0.0004830613299540154,
        "cd_min": 0.000868390594766677,
        "cd_top": 0.00035151131401067737,
        "depth": 0.003588921614561813,
        "max_bow": 0.0002863579280939499,
        "max_cd_error": 0.0003054480468538956,
        "maximum_center_shift": 0.0006087604279961245,
        "scallop_rms": 4.233143307413867e-07,
        "sidewall_angle_deg": 0.06119933683374968
      },
      "pair_id": "design_center:stream_2",
      "panel_id": "design_center",
      "repeat_index": 1,
      "runtime_s": {
        "250": 16.559097207995364,
        "500": 30.676552457996877
      },
      "selected_cycle_match": true,
      "sources": {
        "250": {
          "event_hash": "6fe37bfb1118881de05629b2716bae1ff3a9f7bcc654e439d7b0486a7cf5f6ab",
          "line_number": 5
        },
        "500": {
          "event_hash": "602cf95bc5802b944c170102709cb87196bce09a9cfc26a363d2d10903c54f29",
          "line_number": 6
        }
      },
      "state_match": true,
      "states": {
        "250": "complete_measured",
        "500": "complete_measured"
      }
    },
    {
      "assumed_band_check_matches": {
        "bow": true,
        "depth": true,
        "width": true
      },
      "availability_match": true,
      "failure": null,
      "metric_deltas": {
        "cd_bottom": 0.00023915196385970727,
        "cd_max": 0.001159610083789786,
        "cd_middle": 0.0008890107027785255,
        "cd_min": 0.0003688981636944533,
        "cd_top": 9.49929396001914e-05,
        "depth": 0.0007240844800803226,
        "max_bow": 0.00022526265357811215,
        "max_cd_error": 0.001159610083789786,
        "maximum_center_shift": 0.0005651190830215785,
        "scallop_rms": 8.516532979285438e-05,
        "sidewall_angle_deg": 0.014671970952664884
      },
      "pair_id": "design_center:stream_3",
      "panel_id": "design_center",